<?xml version="1.1" encoding="UTF-8" standalone="no"?>

<Classe
    xmlns:xsi="http://www.w3.org/2001/XMLSchema-instance"
    xsi:noNamespaceSchemaLocation="Imbrications.xsd">
    <Professeur>
        <Nom>Legrain</Nom>
        <Prenom>Samuel</Prenom>
        <AnneeDebut>2010</AnneeDebut>
        <Telephone>028569732</Telephone>
        <Titre>Mr</Titre>
        <Email>samuel.legrain@bstorm.be</Email>
        <Adresse>
            <Rue>Rue des cerisiers</Rue>
            <Numero>25</Numero>
            <CodePostal>8000</CodePostal>
            <Ville>Charleroi</Ville>
        </Adresse>
        <ListeCours>
            <Cours>
                <Intitule>C#</Intitule>
                <Credit>9</Credit>
            </Cours>
            <Cours>
                <Intitule>JavaScript</Intitule>
                <Credit>7</Credit>
            </Cours>
            <Cours>
                <Intitule>XML</Intitule>
                <Credit>1</Credit>
            </Cours>
        </ListeCours>
    </Professeur>
    <Eleve>
        <Nom>Szymon</Nom>
        <Prenom>Menen</Prenom>
        <DateNaissance>1990-05-25</DateNaissance>
        <Email>m.szymon@interface3.be</Email>
    </Eleve>
    <Eleve>
        <Nom>Rafaele</Nom>
        <Prenom>Alessandra</Prenom>
        <DateNaissance>1993-08-15</DateNaissance>
        <Email>a.rafaele@interface3.be</Email>
    </Eleve>
    <Eleve>
        <Nom>Pelivan</Nom>
        <Prenom>sarah</Prenom>
        <DateNaissance>1995-12-02</DateNaissance>
        <Email>s.pelivan@interface3.be</Email>
    </Eleve>
    <Eleve>
        <Nom>Chau</Nom>
        <Prenom>Boa</Prenom>
        <DateNaissance>1989-01-31</DateNaissance>
        <Email>b.chau@interface3.be</Email>
    </Eleve>
    <Eleve>
        <Nom>Stultjens</Nom>
        <Prenom>El√©onore</Prenom>
        <DateNaissance>1993-09-29</DateNaissance>
        <Email>e.stultjens@interface3.be</Email>
    </Eleve>
    <Eleve>
        <Nom>Orianne</Nom>
        <Prenom>Maya</Prenom>
        <DateNaissance>1989-06-09</DateNaissance>
        <Email>m.orianne@interface3.be</Email>
    </Eleve>
</Classe>